{
  "schema": "hashing_config_v1",
  "version": "1",
  "config_id": "s1-se-05-conformance",
  "profile": "CONFORMANCE_ONLY",
  "identity_contract": {
    "schema": "CanonicalEvent/v1",
    "field": "item_id",
    "parser": "source_entity_raw_v1"
  },
  "serialization": {
    "id": "lp_u32be_utf8_namespace_id_v1",
    "length_unit": "BYTE",
    "unicode_normalization": "NONE",
    "case_normalization": "NONE"
  },
  "algorithm": {
    "id": "XXH64",
    "contract_version": "1",
    "digest_bits": 64,
    "digest_interpretation": "UNSIGNED_INTEGER",
    "reference_library": "python-xxhash",
    "reference_library_version": "4.0.1",
    "backend_version": "0.8.3",
    "seed_uint64": "18446744073709551615"
  },
  "bucket_count": 17,
  "reserved_indices": {
    "PAD": 0,
    "OOV": 3,
    "NULL": 16
  },
  "reserved_semantics": {
    "PAD": "MASKED_POSITION_ONLY",
    "OOV": "EXPLICIT_SENTINEL_ONLY",
    "NULL": "EXPLICIT_NULL_ONLY"
  },
  "residual_embedding_dim": 5,
  "config_sha256": "27ee2f0a13adf319efd3ff8e6bf17a96970407fa259b2c229a5fba29c0445fd9"
}
